{
  "schemaVersion": 1,
  "id": "harbor_01",
  "width": 96,
  "height": 64,
  "terrain": [
    "~~~~~~~~~~~~~~~~~~~~~~~~~~~~~~~~~~~~~~~~~~~~~~~~~~~~~~~~~~~~~~~~~~~~~~~~~~~~~~~~~~~~~~~~~~~~~~~~",
    "~~~~~~~~~~~~~~~~~~~~~~~~~~~~~~~~~~~~~~~~~~~~~~~~~~~~~~~~~~~~~~~~~~~~~~~~~~~~~~~~~~~~~~~~~~~~~~~~",
    "~~~~~~~~~~~~~~~~~~~~~~~~~~~~~~~~~~~~~~~~~~~~~~~~~~~~~~~~~~~~~~~~~~~~~~~~~~~~~~~~~~~~~~~~~~~~~~~~",
    "~~~~~~~~~~~~~~~~~~~~~~~~~~~~~~~~~~~~~~~~~~~~~~~~~~~~~~~~~~~~~~~~~~~~~~~~~~~~~~~~~~~~~~~~~~~~~~~~",
    "~~~~~~~~~~~~~~~~~~~~~~~~~~~~~~~~~~~~~~~~~~~~~~~~~~~~~~~~~~~~~~~~~~~~~~~~~~~~~~~~~~~~~~~~~~~~~~~~",
    "~~~~~~~~~~~~~~~~~~~~~~~~~~~~~~~~~~~~~~~~~~~~~~~~~~~~~~~~~~~~~~~~~~~~~~~~~~~~~~~~~~~~~~~~~~~~~~~~",
    "~~~~~~~~~~~~~~~~~~~~~~~~~~~~~~~~~~~~~~~~~~~~~~~~~~~~~~~~~~~~~~~~~~~~~~~~~~~~~~~~~~~~~~~~~~~~~~~~",
    "~~~~~~~~~~~~~~~~~~~~~~~~~~~~~~~~~~~~~~~~~~~~~~~~~~~~~~~~~~~~~~~~~~~~~~~~~~~~~~~~~~~~~~~~~~~~~~~~",
    "~~========================~~~~~~~~~~~~~~~~~~~~~~~~~~~~~~~~~~~~========================~~~~~~~~~~",
    "~~========================~~~~~~~~~~~~~~~~~~~~~~~~~~~~~~~~~~~~========================~~~~~~~~~~",
    "~~====================================================================================~~~~~~~~~~",
    "~~====================================================================================~~~~~~~~~~",
    "======QQQQQQQQQQQQQQQQ============================================QQQQQQQQQQQQQQQQ==============",
    "======QQQQQQQQQQQQQQQQ============================================QQQQQQQQQQQQQQQQ==============",
    "======QQQQQQQQQQQQQQQQ======QQQQQQQQQQQQQQQQQQQQQQQQQQQQQQQQ======QQQQQQQQQQQQQQQQ==============",
    "======QQQ..........QQQ======QQQQQQQQQQQQQQQQQQQQQQQQQQQQQQQQ======QQQ..........QQQ==============",
    "======QQQ..........QQQ======QQQQQQQQQQQQQQQQQQQQQQQQQQQQQQQQ======QQQ..........QQQ==============",
    "======QQQ..........QQQ======................................======QQQ..........QQQ==============",
    "======QQQ..........QQQ======................................======QQQ..........QQQ==========....",
    "======QQQ..........QQQ======................................======QQQ..........QQQ==========....",
    "======QQQ..........QQQ======................................======QQQ..........QQQ==========....",
    "======QQQ..........QQQ======................................======QQQ..........QQQ==========....",
    "======QQQ..........QQQ======................................======QQQ..........QQQ==========....",
    "======QQQ..........QQQ======................................======QQQ..........QQQ==========....",
    "======QQQ..........QQQ======................................======QQQ..........QQQ==========....",
    "======QQQ..........QQQ======................................======QQQ..........QQQ==========....",
    "======QQQ..........QQQ======................................======QQQ..........QQQ==========....",
    "======QQQ..........QQQ======................................======QQQ..........QQQ==========....",
    "======QQQ..........QQQ======................................======QQQ..........QQQ==========....",
    "======QQQ..........QQQ======................................======QQQ..........QQQ==========....",
    "======QQQ..........QQQ======................................======QQQ..........QQQ==========....",
    "======QQQ..........QQQ======................................======QQQ..........QQQ==========....",
    "======QQQ..........QQQ======................................======QQQ..........QQQ==========....",
    "======QQQ..........QQQ======................................======QQQ..........QQQ==========....",
    "======QQQ..........QQQ============....................============QQQ..........QQQ==========....",
    "======QQQ..........QQQ============....................============QQQ..........QQQ==========....",
    "======QQQ..........QQQ============....................============QQQ..........QQQ==========....",
    "======QQQ..........QQQ============....................============QQQ..........QQQ==========....",
    "======QQQ..........QQQ============....................============QQQ..........QQQ==========....",
    "======QQQ..........QQQ============....................============QQQ..........QQQ==========....",
    "======QQQ..........QQQ============....................============QQQ..........QQQ==========....",
    "======QQQ..........QQQ============....................============QQQ..........QQQ==========....",
    "======QQQ..........QQQ============....................============QQQ..........QQQ==========....",
    "======QQQ..........QQQ============....................============QQQ..........QQQ==========....",
    "======QQQ..........QQQ============....................============QQQ..........QQQ==========....",
    "======QQQ..........QQQ============....................============QQQ..........QQQ==========....",
    "======QQQ..........QQQ============....................============QQQ..........QQQ==========....",
    "======......##........============....................============......##........==========....",
    "======......##........============....................============......##........==========....",
    "======................============....................============................==========....",
    "................................................................................................",
    "................................................................................................",
    "................................................................................................",
    "................................................................................................",
    "............................................................######..............................",
    "..####......................................................######..............................",
    "..####........####..........................................######..............................",
    "..####........####..........................................######..................######......",
    "..####........####..................................................................######......",
    "..............####..................................................................######......",
    "....................................................................................######......",
    "................................................................................................",
    "................................................................................................",
    "................................................................................................"
  ],
  "depth": { "6,12,8,3": 2, "14,12,8,3": 1, "6,15,3,32": 2, "19,15,3,32": 1, "30,14,28,3": 1, "66,12,16,35": 3 },
  "parcels": [
    { "id": "starter", "rect": { "x": 30, "y": 14, "w": 28, "h": 20 }, "priceCents": 60000000, "leasable": false, "startOwned": true },
    { "id": "west_quay", "rect": { "x": 6, "y": 12, "w": 16, "h": 38 }, "priceCents": 32000000, "leasable": true },
    { "id": "east_yard", "rect": { "x": 66, "y": 12, "w": 16, "h": 38 }, "priceCents": 58000000, "leasable": true }
  ],
  "roadPortals": [
    { "id": "road_south", "cell": { "x": 44, "y": 63 } }
  ],
  "railPortals": [
    { "id": "rail_east", "cell": { "x": 95, "y": 24 } }
  ],
  "seaLane": [
    { "x": 48, "y": 0 },
    { "x": 48, "y": 7 },
    { "x": 44, "y": 7 }
  ],
  "anchorage": [
    { "x": 38, "y": 2 },
    { "x": 31, "y": 5 },
    { "x": 58, "y": 2 },
    { "x": 24, "y": 2 },
    { "x": 65, "y": 5 },
    { "x": 72, "y": 2 },
    { "x": 10, "y": 2 },
    { "x": 86, "y": 2 }
  ],
  "starter": {
    "modules": [
      { "defId": "berth_standard", "x": 40, "y": 14, "rotation": 0 },
      { "defId": "crane_container_gantry", "x": 43, "y": 14, "rotation": 0 }
    ],
    "roads": [
      { "x": 44, "y": 63 },
      { "x": 44, "y": 62 },
      { "x": 44, "y": 61 },
      { "x": 44, "y": 60 },
      { "x": 44, "y": 59 },
      { "x": 44, "y": 58 },
      { "x": 44, "y": 57 },
      { "x": 44, "y": 56 },
      { "x": 44, "y": 55 },
      { "x": 44, "y": 54 },
      { "x": 44, "y": 53 },
      { "x": 44, "y": 52 },
      { "x": 44, "y": 51 },
      { "x": 44, "y": 50 },
      { "x": 44, "y": 49 },
      { "x": 44, "y": 48 },
      { "x": 44, "y": 47 },
      { "x": 44, "y": 46 },
      { "x": 44, "y": 45 },
      { "x": 44, "y": 44 },
      { "x": 44, "y": 43 },
      { "x": 44, "y": 42 },
      { "x": 44, "y": 41 },
      { "x": 44, "y": 40 },
      { "x": 44, "y": 39 },
      { "x": 44, "y": 38 },
      { "x": 44, "y": 37 },
      { "x": 44, "y": 36 },
      { "x": 44, "y": 35 },
      { "x": 44, "y": 34 }
    ]
  }
}
